fault_id,subsystem,severity,short_description,long_description,pilot_actions
CCC-001,CCC,medium,CCC Fault,"The communication control computer fails in flight, disrupting radio tuning, data link routing, or communication status reporting.","Select backup radio paths if available, reduce reliance on data link coordination, use prebriefed comm procedures, and recover if communication loss compromises mission safety."
CCC-002,CCC,medium,Antenna Switch,"The communication control computer mismanages antenna or channel switching in flight, causing intermittent transmit or receive loss across assigned radios.","Reattempt essential calls on alternate radios or presets, simplify communication setup, and use backup procedures if primary routing remains unreliable."
CCC-003,CCC,high,Data Link Loss,"Data-link control through the communication computer is lost in flight, degrading tactical coordination, remote cueing, or network track exchange.","Fall back to voice procedures, simplify formation tactics, and treat offboard tactical data as unavailable until stable communications are restored."
CCC-004,CCC,medium,Crypto Sync Fail,"Communication crypto or secure-link synchronization fails in flight, preventing secure exchange even though radios remain powered.","Switch to authorized alternate communication modes or procedures, reduce dependency on secure networking, and terminate tasks that require protected coordination."
CCC-005,CCC,medium,Radio Tune Err,"Radio tuning logic behaves incorrectly in flight, selecting wrong presets, frequencies, or channel states and causing communication confusion.","Cross-check active frequency carefully, minimize channel changes, and use prebriefed backup frequencies if tuning remains suspect."
